{
  "source": "ptk",
  "type": "dast_findings_batch",
  "schema": "ptk-zap-dast-finding-v1",
  "ts": 1773068000000,
  "batchId": "batch-dast-demo-free",
  "payload": {
    "engine": "DAST",
    "scanId": "ce3cac9a-7f7b-4d5d-b77f-28d063a4594b",
    "truncated": false,
    "findings": [
      {
        "id": "ce3cac9a-7f7b-4d5d-b77f-28d063a4594b::DAST::headers::header_csp_missing::req-2::atk-8",
        "fingerprint": "ce3cac9a-7f7b-4d5d-b77f-28d063a4594b::DAST::headers::header_csp_missing::req-2::atk-8",
        "moduleId": "headers",
        "ruleId": "header_csp_missing",
        "attackId": "header_csp_missing",
        "severity": "low",
        "confidence": 78,
        "summary": "Missing Content-Security-Policy header",
        "location": {
          "url": "http://localhost:3001/",
          "route": "/",
          "method": "GET",
          "param": null
        },
        "proof": {
          "payload": null,
          "proof": null,
          "summary": "Missing Content-Security-Policy header"
        },
        "request": {
          "timestamp": 1773065208351,
          "method": "GET",
          "url": "http://localhost:3001/",
          "raw": "GET http://localhost:3001/ HTTP/1.1\r\nHost: localhost:3001\r\nCache-Control: no-cache\r\nPragma: no-cache"
        },
        "response": {
          "statusCode": 200,
          "timeMs": 156,
          "raw": "HTTP/1.1 200 OK\r\naccept-ranges: bytes\r\naccess-control-allow-origin: *\r\ncache-control: public, max-age=0\r\nconnection: keep-alive\r\ncontent-encoding: br\r\ncontent-type: text/html; charset=UTF-8\r\ndate: Mon, 09 Mar 2026 14:06:48 GMT\r\netag: W/\"1252f-19ccc31c0f0\"\r\nfeature-policy: payment 'self'\r\nkeep-alive: timeout=5\r\nlast-modified: Sun, 08 Mar 2026 06:45:38 GMT\r\ntransfer-encoding: chunked\r\nvary: Accept-Encoding\r\nx-content-type-options: nosniff\r\nx-frame-options: SAMEORIGIN\r\nx-recruiting: /#/jobs\r\n\r\n"
        }
      },
      {
        "id": "ce3cac9a-7f7b-4d5d-b77f-28d063a4594b::DAST::recon_cache_privacy::recon_missing_referrer_policy::req-2::atk-9",
        "fingerprint": "ce3cac9a-7f7b-4d5d-b77f-28d063a4594b::DAST::recon_cache_privacy::recon_missing_referrer_policy::req-2::atk-9",
        "moduleId": "recon_cache_privacy",
        "ruleId": "recon_missing_referrer_policy",
        "attackId": "recon_missing_referrer_policy",
        "severity": "low",
        "confidence": 78,
        "summary": "Missing Referrer-Policy",
        "location": {
          "url": "http://localhost:3001/",
          "route": "/",
          "method": "GET",
          "param": null
        },
        "proof": {
          "payload": null,
          "proof": null,
          "summary": "Missing Referrer-Policy"
        },
        "request": {
          "timestamp": 1773065208351,
          "method": "GET",
          "url": "http://localhost:3001/",
          "raw": "GET http://localhost:3001/ HTTP/1.1\r\nHost: localhost:3001\r\nCache-Control: no-cache\r\nPragma: no-cache"
        },
        "response": {
          "statusCode": 200,
          "timeMs": 156,
          "raw": "HTTP/1.1 200 OK\r\naccept-ranges: bytes\r\naccess-control-allow-origin: *\r\ncache-control: public, max-age=0\r\nconnection: keep-alive\r\ncontent-encoding: br\r\ncontent-type: text/html; charset=UTF-8\r\ndate: Mon, 09 Mar 2026 14:06:48 GMT\r\netag: W/\"1252f-19ccc31c0f0\"\r\nfeature-policy: payment 'self'\r\nkeep-alive: timeout=5\r\nlast-modified: Sun, 08 Mar 2026 06:45:38 GMT\r\ntransfer-encoding: chunked\r\nvary: Accept-Encoding\r\nx-content-type-options: nosniff\r\nx-frame-options: SAMEORIGIN\r\nx-recruiting: /#/jobs\r\n\r\n"
        }
      },
      {
        "id": "ce3cac9a-7f7b-4d5d-b77f-28d063a4594b::DAST::host_header_poisoning::hostpoison_1::req-2::atk-102",
        "fingerprint": "ce3cac9a-7f7b-4d5d-b77f-28d063a4594b::DAST::host_header_poisoning::hostpoison_1::req-2::atk-102",
        "moduleId": "host_header_poisoning",
        "ruleId": "hostpoison_1",
        "attackId": "hostpoison_1",
        "severity": "medium",
        "confidence": 78,
        "summary": "Poison host in headers",
        "location": {
          "url": "http://localhost:3001/",
          "route": "/",
          "method": "GET",
          "param": "Host"
        },
        "proof": {
          "payload": "evil.example",
          "proof": "Attack response matches baseline (status and body).",
          "summary": "Poison host in headers"
        },
        "request": {
          "timestamp": 1773065282750,
          "method": "GET",
          "url": "http://localhost:3001/",
          "raw": "GET http://localhost:3001/ HTTP/1.1\r\nHost: evil.example\r\nCache-Control: no-cache\r\nPragma: no-cache\r\nX-Forwarded-Host: evil.example\r\nX-Forwarded-Proto: http\r\nForwarded: host=evil.example;proto=http"
        },
        "response": {
          "statusCode": 200,
          "timeMs": 4886,
          "raw": "HTTP/1.1 200 OK\r\naccept-ranges: bytes\r\naccess-control-allow-origin: *\r\ncache-control: public, max-age=0\r\nconnection: keep-alive\r\ncontent-encoding: br\r\ncontent-type: text/html; charset=UTF-8\r\ndate: Mon, 09 Mar 2026 14:08:07 GMT\r\netag: W/\"1252f-19ccc31c0f0\"\r\nfeature-policy: payment 'self'\r\nkeep-alive: timeout=5\r\nlast-modified: Sun, 08 Mar 2026 06:45:38 GMT\r\ntransfer-encoding: chunked\r\nvary: Accept-Encoding\r\nx-content-type-options: nosniff\r\nx-frame-options: SAMEORIGIN\r\nx-recruiting: /#/jobs\r\n\r\n"
        }
      },
      {
        "id": "ce3cac9a-7f7b-4d5d-b77f-28d063a4594b::DAST::headers::header_x_frame_options_obsolete::req-1::atk-11",
        "fingerprint": "ce3cac9a-7f7b-4d5d-b77f-28d063a4594b::DAST::headers::header_x_frame_options_obsolete::req-1::atk-11",
        "moduleId": "headers",
        "ruleId": "header_x_frame_options_obsolete",
        "attackId": "header_x_frame_options_obsolete",
        "severity": "low",
        "confidence": 78,
        "summary": "X-Frame-Options header is a legacy directive",
        "location": {
          "url": "http://localhost:3001/rest/admin/application-configuration",
          "route": "/rest/admin/application-configuration",
          "method": "GET",
          "param": null
        },
        "proof": {
          "payload": null,
          "proof": "x-frame-options",
          "summary": "X-Frame-Options header is a legacy directive"
        },
        "request": {
          "timestamp": 1773065206293,
          "method": "GET",
          "url": "http://localhost:3001/rest/admin/application-configuration",
          "raw": "GET http://localhost:3001/rest/admin/application-configuration HTTP/1.1\r\nSec-Ch-Ua-Platform: macOS\r\nUser-Agent: Mozilla/5.0 (Macintosh; Intel Mac OS X 10_15_7) AppleWebKit/537.36 (KHTML, like Gecko) Chrome/145.0.0.0 Safari/537.36 Edg/145.0.0.0\r\nAccept: application/json, text/plain, */*\r\nSec-Ch-Ua: \"Not:A-Brand\";v=\"99\", \"Microsoft Edge\";v=\"145\", \"Chromium\";v=\"145\"\r\nSec-Ch-Ua-Mobile: ?0\r\nSec-Fetch-Site: same-origin\r\nSec-Fetch-Mode: cors\r\nSec-Fetch-Dest: empty\r\nReferer: http://localhost:3001/\r\nAccept-Encoding: gzip, deflate, br, zstd\r\nAccept-Language: en-GB,en;q=0.9,en-US;q=0.8\r\nCookie: cookieconsent_status=dismiss; language=en; welcomebanner_status=dismiss; id_token=eyJhbG..._w1o; continueCode=mD3QgnWmjXz3NDqJkEr7RyL24G2VfEvu53Gep19aoOYwbBlPvZ86KxV5Mby6; csrf_token=d8477b...9ac6; access_token=s%3ATr...%2Bo\r\nCache-Control: no-cache\r\nPragma: no-cache\r\nHost: localhost:3001"
        },
        "response": {
          "statusCode": 200,
          "timeMs": 89,